title,body,day,month,year
North Korea resumes weapons testing with launch of long-range missile,"SEOUL, South Korea (AP) — North Korea on Monday conducted its first intercontinental ballistic missile test in five months, likely launching a developmental, more agile weapon, as it vows strong responses against U.S. and South Korean moves to boost their nuclear deterrence plans.The South Korean government described the missile tested as a solid-fueled weapon, a likely reference to the North’s road-mobile Hwasong-18 ICBM whose built-in solid propellants make its launch more difficult for adversaries to detect than liquid-fueled weapons. North Korean leader Kim Jong Un previously called the Hwasong-18 the most powerful weapon of his nuclear forces.WATCH: White House announces U.S., South Korea and Japan officials will meet to discuss North Korean threatSouth Korea’s military said the North Korean missile flew about 1,000 kilometers (620 miles) before landing in the waters between the Korean Peninsula and Japan. It said the missile was launched on an elevated angle, an apparent attempt to avoid neighboring countries. Japanese lawmaker Masahisa Sato, citing Japan’s Defense Ministry, said the missile rose as high as 6,000 kilometers (3,730 miles).The reported flight details matched those of North Korea’s second test of the Hwasong-18 missile in July. The North first test-fired the missile in April.Since 2017, North Korea has carried out a slew of ICBM tests in a bid to acquire the ability to launch nuclear strikes on the U.S. mainland. But all of its previous tests before April’s Hwasong-18 launch involved liquid-propellent ICBMs, which need to be fueled before launch and cannot stay fueled for long periods.U.S. national security adviser Jake Sullivan spoke with his South Korean and Japanese counterparts on the phone and condemned the North Korean launch as a violation of multiple U.N. Security Council resolutions that ban any ballistic activities by the North. South Korean President Yoon Suk Yeol separately ordered officials to maintain a solid South Korean-U.S. joint defense posture and respond “swiftly and overwhelmingly” to any North Korean provocations against South Korea.The North’s ICBM test was its second weapons firing in less than a day. On Sunday night, it launched a short-range ballistic missile designed to strike South Korea that also splashed in the water off its east coast, according to its neighbors.Observers said the back-to-back launches were likely to protest announcements by South Korea and the United States that they will bolster their joint nuclear deterrence capabilities in the face of North Korea’s evolving nuclear threats.Senior U.S. and South Korean officials met in Washington on Friday for their second Nuclear Consultative Group meeting. They agreed to update their nuclear deterrence and contingency strategies and incorporate nuclear operation scenarios in their combined military exercises next summer, according to officials in Seoul.The consultative body is responsible for sharing information on nuclear and strategic weapons operation plans and joint operations, though the U.S. will retain operational control of its nuclear weapons. U.S. officials said the group’s establishment and other steps to solidify U.S. security commitment were meant to ease South Korean worries about North Korean provocations while keeping Seoul from pursuing its own nuclear program.North Korea’s Defense Ministry on Sunday called its rivals’ decision to include nuclear operation scenarios in their joint drills an open threat to potentially use nuclear weapons against the North. It said any attempt by enemies to use military force against North Korea will be met with “a preemptive and deadly counteraction.”Park Won Gon, a professor at Seoul’s Ewha Womans University, said North Korea’s latest ICBM launch was seen as an effort to improve its military capability to attack the U.S. mainland because it views the South Korea-U.S. nuclear deterrence strategy as a security threat.READ MORE: U.S. says North Korea delivered 1,000 containers of equipment and munitions to RussiaPark said the launch was also likely designed to boost Kim Jong Un’s military credentials at home ahead of a key ruling party meeting next week as he appeared to lack economic achievements.Since last year, North Korea has performed about 100 ballistic missile tests in what experts say is an attempt to enlarge its arsenal and wrest greater U.S. concessions. The U.S. and South Korea have responded by expanding their military drills and increased the temporary deployments of strategic U.S. assets such as aircraft carriers, nuclear-capable bombers and a nuclear-armed submarine in and near South Korea.Du Hyeogn Cha, an analyst at Seoul’s Asan Institute for Policy Studies, said North Korea is expected to continue weapons testing to pressure the U.S. to change its policy on the North.“No matter whether the Biden administration stays or steps out (of the White House) after the presidential election next year, North Korea will raise tensions on the Korean Peninsula to bring change of the U. S. government’s policy on it,” Cha said.Animosities between the Koreas further deepened after North Korea launched its first military reconnaissance satellite into space on Nov. 21 in violation of U.N. bans. South Korea, the U.S. and Japan strongly condemned it as an attempt by the North to improve its missile technology as well as establish a space-based surveillance system.The U.S., South Korea and Japan are pushing to put into operation the sharing of real-time missile warning data on North Korea within days, South Korea’s Defense Ministry said Monday. Ministry officials said the three countries closely shared their information about Monday’s launch.Meeting with reporters in Tokyo, Adm. John Aquilino, commander of the U.S. Indo-Pacific Command, expressed concerns about North Korea’s increasing missile capabilities. But he said that the United States, Japan and South Korea are working more closely than ever and that they were even ready for Monday’s launch and had mobilized their missile defense ships forward earlier this week.“The fact that we were able to predict a launch and then posture forces in advance that was pretty, pretty impressive,” Aquilino said, adding that it was not the first time but hard to do.Yamaguchi reported from Tokyo. Associated Press writer Jiwon Song contributed to this report."
EU investigates X over potential violations of social media law,"LONDON (AP) — The European Union on Monday made Elon Musk’s online platform X the first tech company to face an investigation under Europe’s tough new regulations designed to clean up social media and protect people from toxic online content.“Today we open formal infringement proceedings against @X” under the Digital Services Act, European Commissioner Thierry Breton said in a post on the platform formerly known as Twitter.READ MORE: IBM, EU and Lionsgate pull ads from X over concerns of antisemitic messagesThe 27-nation bloc is ratcheting up the pressure on X after asking the company in October for information on its handling of hate speech, misinformation and violent terrorist content related to the Israel-Hamas war. The case presents the first test for the Digital Services Act, part of a set of pioneering regulations that the EU has drawn up to rein in the power of tech companies.The European Commission, the EU’s executive branch, “will now investigate X’s systems and policies related to certain suspected infringements” of the DSA, spokesman Johannes Bahrke told a press briefing in Brussels. “It does not prejudge the outcome of the investigation.”The San Francisco-based social media platform says it is “committed to complying with the Digital Services Act, and is cooperating with the regulatory process. It is important that this process remains free of political influence and follows the law.”“X is focused on creating a safe and inclusive environment for all users on our platform, while protecting freedom of expression, and we will continue to work tirelessly towards this goal,” the company said in a statement.Musk has touted the platform as a place for free speech to thrive, but changes that the billionaire Tesla CEO made to the site after he bought it a year ago — such as cutting the number of content moderators and restoring the banned accounts of divisive public personalities — have turned off users and advertisers, who have fled over concerns about hate speech appearing alongside their ads.WATCH: Musk’s X is the largest source of disinformation, EU official saysThe EU’s investigation will look into whether X failed to do enough to curb the spread of illegal content — such as hate speech or incitement of terrorism — to its 112 million users in Europe.That includes the effectiveness of X’s tools for users to flag up illegal material in posts and ads so that it can be swiftly removed, as well as whether the company is following its own policies on restricting “sensitive content.”The investigation also will examine whether X’s measures to combat “ information manipulation,” especially through its crowd-sourced Community Notes fact-checking feature, were effective within the European Union.Another area of investigation is transparency. The EU said there are “suspected shortcomings” in researchers’ access to X’s publicly accessible data” as well as its ad database, both of which are required by the DSA.Lastly, the investigation will look into whether users are being tricked by suspected “deceptive design” of X’s interface, including for its blue check subscription service. The blue checkmarks once signified that the person or institution behind an account was genuine, such as a celebrity, athlete or journalist, but now merely indicate someone pays $8 a month to boost their posts above unchecked users.WATCH: Social media companies criticized as Israel-Hamas war misinformation spreads rampantlyThe EU has called out X as the worst place online for fake news, and officials have exhorted owner Musk to do more to clean it up.Now, it’s taking official steps under the Digital Services Act, a set of far-reaching rules designed to keep users safe online and stop the spread of harmful content that’s either illegal or violates a platform’s terms of service, such as promotion of genocide or anorexia.A raft of big tech companies faced stricter scrutiny after the DSA took effect earlier this year, threatening penalties of up to 6% of their global revenue — which could amount to billions — or even a ban from the EU.Fines are, however, considered a last ditch resort, and Brussels could first use “interim measures” to force companies to comply.There’s no deadline for a decision on the investigation into X, and the commission said it would continue to gather evidence, carry out interviews and conduct inspections."
Ukraine’s military chief says routine sweep discovered bugged office,"KYIV, Ukraine (AP) — Ukraine’s military chief said Monday that a covert listening device was found in one of the offices where he works, and hinted without elaborating that bugs were detected in other locations.Army Cmdr. Valeriy Zaluzhnyi commented to local media about Sunday’s revelation by Ukraine’s Security Service that during a routine sweep a bug was found in a room he used. The device wasn’t working, the agency said.WATCH: Putin vows to press on with Ukraine invasion despite heavy Russian lossesSuspicion immediately fell on Russia amid the almost 22-month war between the two countries that is set to grind on into another year.“I have several offices where I work. This happened in one of them,” Zaluzhnyi said. “We checked (the room) and found (the device),” he said.He added that listening devices were not only found in the office where he worked, but he didn’t provide further details and left it unclear whether more than one device was found in the Ukraine General Staff premises.The murky developments left lots of questions unanswered. Officials did not comment further.The intelligence services of both Russia and Ukraine have been active during the war.Ukraine’s military intelligence chief has survived 10 assassination attempts carried out by the Russian state security service, or FSB, according to Ukrainian authorities. Last month, his wife underwent hospital treatment after being diagnosed with heavy metals poisoning.READ MORE: Russian drones hit Black Sea coast while Ukraine targets air base in RussiaUkraine’s spy agency, meanwhile, reportedly has been active in sabotage operations far behind the front line.Artillery bombardments continue to claim civilians lives as the front-line fighting becomes bogged down by wintry mud and snow.Two Ukrainian civilians were killed and at least two were injured over the previous 24 hours, the president’s office reported Monday.In the north, the Russian army shelled the village of Krasnopillia in the Sumy region, killing a civilian in his home and damaging residential buildings, it said. In the south, an 81-year-old man died on the street during an attack on the center of Kherson city.Associated Press Writer Yuras Karmanau in Tallinn, Estonia, contributed to this report."
Serbia’s opposition takes to the streets claiming election fraud in Sunday’s vote,"BELGRADE, Serbia (AP) — Serbia’s weekend snap election was held in “unjust conditions,” with multiple reports of irregularities, international observers said on Monday, as opponents of populist President Aleksandar Vucic took to the streets claiming the vote was rigged.Political tensions spiked in the Balkan country over the parliamentary and local elections on Sunday. In Belgrade, several thousand people gathered in front of the state election commission headquarters, chanting “thieves,” as opposition leaders moved to lodge formal complaints claiming fraud in the city election.“We have hundreds and hundreds of complaints, said opposition politician Marinika Tepic. She and several other opposition politicians will camp inside the building that’s the seat of the state election commission. “We will stay here for a while.”At one point, protesters broke through a fence surrounding the building and one young woman tried to storm the entrance. Protesters threw eggs, tomatoes and rolls of toilet paper at the building.Vucic’s ruling Serbian Progressive Party won the parliamentary vote, an early official count confirmed. However, in the Belgrade local election, an opposition group said it was robbed, would not recognize the results and would demand a rerun of the ballot.The Serbian president appeared on state RTS television on Monday evening, stating that the “election was fair” and that he wanted “to tell the people not to worry … peace, law and order will prevail.”In a preliminary statement, a mission made up of representatives of international rights watchdogs said the vote was “marred by harsh rhetoric, bias in the media, pressure on public sector employees and misuse of public resources.”EXPLAINER: What is behind renewed tensions between Serbia and Kosovo?“Election day was smoothly conducted but was marked by numerous procedural deficiencies, including inconsistent application of safeguards during voting and counting, frequent instances of overcrowding, breaches in secrecy of the vote, and numerous instances of group voting,” the conclusions said.Vucic, who has been in power since 2012, has dismissed criticism from his opponents that his government curbed democratic freedoms while allowing corruption and organized crime to run rampant.Under Vucic, Serbia became a candidate for EU membership, but the opposition accuses the bloc of turning a blind eye to the country’s democratic shortcomings in return for stability in the Balkan region, still troubled after the wars of the 1990s.The election pitted Vucic’s SNS against the Serbia Against Violence opposition alliance, or SPN.Vucic’s party won nearly 47 percent of the ballots in the parliamentary vote, followed by Serbia Against Violence with 23 percent, according to a near-complete preliminary tally by the state election commission.Several other smaller parties also competed in the election, which was held only 18 months after the previous presidential and parliamentary vote.If confirmed in the final vote count, the result means that the SNS party will have an absolute majority in the 250-member parliament and will form the next government on its own.Officials results for the city hall in Belgrade are yet to be announced, but projections by polling agencies IPSOS and CESID said SNS won 38 percent of the ballots, while Serbia Against Violence garnered 35 percent.Irregularities also were reported by election monitors and independent media in Serbia.Local independent Center for Research, Transparency and Accountability said the abuses were of such “scope and diversity” that “the results of the Belgrade elections do not reflect the freely expressed will of voters living in Belgrade.”“Irregularities that directly compromised election results were recorded at 5 percent of polling stations in Parliamentary elections and at 9 percent of polling stations in the Belgrade elections,” said the center.One report claimed ethnic Serbs from neighboring Bosnia were bused in en masse to vote in Belgrade. Serbia Against Violence charged that 40,000 identity documents were issued for people who do not live in the Serbian capital.Another report said a monitoring team was assaulted and their car was attacked with baseball bats in a town in northern Serbia. Allegations have also emerged of voters being paid or pressured to vote for the ruling party.“We brought evidence about flagrant theft in Belgrade,” said Tepic, the opposition politician. She said voters were brought in from abroad to “decide how citizens of Belgrade will live.”The international mission report further “raised concerns about voters’ ability to make a choice free from undue pressure.” Pressure on voters and misuse of public offices “tilted the playing field, and blurred the line between state and the party,” the observers added.Serious irregularities included cases of vote-buying and ballot box stuffing, said the joint conclusions by the OSCE Office for Democratic Institutions and Human Rights, the OSCE Parliamentary Assembly, the Parliamentary Assembly of the Council of Europe and the European Parliament.Vucic and his party have denied the allegations.The election did not include a vote for the president but governing authorities backed by the dominant pro-government media ran the campaign as a referendum on Vucic.Serbia Against Violence, a pro-European Union bloc, includes parties that were behind months of street protests this year triggered by two back-to-back mass shootings in May."
North Dakota lawsuit to recoup policing costs for pipeline protests set for trial,"BISMARCK, N.D. (AP) — A court fight over whether the federal government should cover North Dakota’s $38 million in costs of responding to the lengthy protests of the Dakota Access oil pipeline years ago near its controversial river crossing will continue as a judge said the case is “ripe and ready for trial.”The state filed the lawsuit in 2019, seeking $38 million. The lawsuit’s bench trial was scheduled earlier this month to begin Feb. 15, 2024, in Bismarck before U.S. District Court Judge Daniel Traynor, estimated to last 12-13 days.Traynor on Wednesday denied the federal government’s motion for summary judgment to dismiss the case, and granted the state’s motion to find that the U.S. Army Corps of Engineers “failed to follow its mandatory permitting procedures” for the protest activities on its land, among several rulings he made in his order.Thousands of people gathered to camp and demonstrate near the pipeline’s controversial Missouri River crossing upstream of the Standing Rock Reservation. The Standing Rock Sioux Tribe has long opposed the pipeline due to the potential risk of the line breaking and contaminating the tribe’s water supply.READ MORE: Federal officials leave future of Dakota Access pipeline’s river crossing unclear in draft reviewThe Corps’ “abdication of the responsibility it undertook to maintain public safety at the protest site left North Dakota, at both the State and local level, with the entire burden to protect public safety and maintain law and order in the face of the brazen illegal conduct,” the state said in its 2019 complaint.North Dakota Attorney General Drew Wrigley said negotiations continue with the federal government as the trial looms.“This is an important and complicated and, now at this point, protracted matter,” he said Monday. “We’ve made our best assessment, not based on just what we can say with a straight face, but what we believe the law of the United States and the equities involved in this case merit, and we’re sticking to that.”The protests, which drew international attention, lasted from roughly August 2016 to February 2017 and resulted in hundreds of arrests and subsequent criminal cases. The pipeline has been transporting oil since June 2017.In 2017, the pipeline company donated $15 million to help cover the response costs, and the U.S. Justice Department also gave a $10 million grant to the state for reimbursement.Former President Donald Trump denied a request from the state for the federal government to cover the costs through a disaster declaration.A public comment period recently ended on the draft of a court-ordered environmental review of the pipeline’s river crossing. The process is key for the future of the pipeline, with a decision expected in late 2024. The document laid out options of denying the easement and removing or abandoning the line’s river segment, granting the easement with no changes or with additional safety measures, or rerouting the pipeline north of Bismarck."
