title,body,day,month,year
California is set to become 2nd state to approve rules for turning wastewater into drinking water,"SACRAMENTO, Calif. (AP) — When a toilet is flushed in California, the water can end up in a lot of places — the ice in a skating rink, the manufactured snow on ski slopes, in pipes providing irrigation for farmland. And — coming soon — in your drinking glass.California regulators on Tuesday are set to vote on new rules to let water agencies recycle wastewater and put it right back into the pipes that carry drinking water to homes, schools and businesses.It’s a big step for a state that has struggled for decades to have a reliable source of drinking water for its more than 39 million residents. And it signals a shift in public opinion on a subject that as recently as two decades ago prompted backlash that scuttled similar projects.Since then, California has been through multiple extreme droughts, including the most recent one that scientists say was the driest three-year period on record and left the state’s reservoirs at dangerously low levels.“Water is so precious in California. It is important that we use it more than once,” said Jennifer West, managing director of WateReuse California, a group advocating for recycled water.READ MORE: Biden to send disaster assistance to Louisiana, as salt water threatens the state’s drinking waterCalifornia has been using recycled wastewater for decades. The Ontario Reign minor league hockey team has used it to make ice for its rink in Southern California. Soda Springs Ski Resort near Lake Tahoe has used it to make snow. And farmers in the Central Valley, where much of the nation’s vegetables, fruits and nuts are grown, use it to water their crops.But it hasn’t been used directly for drinking water. Orange County operates a large water purification system that recycles wastewater and then uses it to refill underground aquifers. The water mingles with the groundwater for months before being pumped up and used for drinking water again.California’s new rules would let — but not require — water agencies to take wastewater, treat it, and then put it right back into the drinking water system. California would be just the second state to allow this, following Colorado.The rules would require the wastewater be treated for all pathogens and viruses, even if the pathogens and viruses aren’t in the wastewater. That’s different from regular water treatment rules, which only require treatment for known pathogens, said Darrin Polhemus, deputy director of the division of drinking water for the California Water Resources Control Board.In fact, the treatment is so stringent it removes all of the minerals that make fresh drinking water taste good — meaning they have to be added back at the end of the process.READ MORE: How ‘solar canals’ could help California reach sustainable energy goals“It’s at the same drinking water quality, and probably better in many instances,” Polhemus said.It’s expensive and time consuming to build these treatment facilities, so Polhemus said it will only be an option for bigger, well-funded cities — at least initially. That includes San Diego, where city officials have a plan to build a water recycling program that they say would account for nearly half of the city’s water by 2035.Water agencies will need public support to complete these projects. The rules require water agencies to tell customers about the recycled water before they start doing it.In San Jose, local officials have opened the Silicon Valley Advanced Water Purification Center for public tours “so that people can see that this is a very high tech process that ensures the water is super clean,” said Kirsten Struve, assistant officer for the water supply division at the Santa Clara Valley Water District.Right now, the agency uses the water for things like irrigating parks and playing fields. But they plan to use it for drinking water in the future.“We live in California where the drought happens all the time. And with climate change, it will only get worse,” Struve said. “And this is a drought resistant supply that we will need in the future to meet the demands of our communities.”Associated Press video journalist Terry Chea contributed reporting from San Jose, California."
"As election year approaches, Vice President Harris announces nationwide events focused on abortion","WASHINGTON (AP) — Vice President Kamala Harris is redoubling her focus on abortion rights as the election year begins, planning a nationwide series of events as Democrats try to rally voters to give President Joe Biden a second term and regain full control of Congress.Her first event is scheduled for Wisconsin on Jan. 22, which would have been the 51st anniversary of Roe v. Wade, the landmark Supreme Court case that legalized abortion nationwide. The court overturned the decision in 2022 in the case of Dobbs v. Jackson Women’s Health Organization.“I will continue to fight for our fundamental freedoms while bringing together those throughout America who agree that every woman should have the right to make decisions about her own body — not the government,” Harris said in a statement.Wisconsin is a critical battleground state where access to abortion has seesawed since the Supreme Court decision.READ MORE: Advocates are trying to put abortion on the 2024 ballot in these states. Here’s where they stand nowOther dates and locations for Harris’ tour have not yet been announced.The loss of Roe v. Wade was a historic setback for Democrats, and there’s no clear path to restoring nationwide abortion rights as Republican-led states enact new restrictions.However, Democrats successfully harnessed anger over the decision to stem their losses in the 2022 midterms — Republicans narrowly took control of the House rather than winning wipeout victories that had been forecast — and they plan to make the issue a rallying cry in 2024 as well.Vice presidents are rarely decisive in election campaigns, but Harris is poised to play an important role next year.Part of that reason is Biden’s age; he would be 86 at the end of his second term.She’s also led the charge for the White House on abortion, holding more than 50 events in at least 16 states with lawmakers, attorneys general, activists and healthcare providers.The issue was a focus for her recent college tour as well, when she visited campuses to speak to students."
"UN Security Council continues tense negotiations on Gaza humanitarian resolution, trying to avoid U.S. veto","UNITED NATIONS (AP) — U.N. Security Council members were in intense negotiations Tuesday on an Arab-sponsored resolution to spur desperately needed humanitarian aid deliveries to Gaza during some kind of a halt in the fighting, trying to avoid another veto by the United States.U.S. Deputy Ambassador Robert Wood told reporters Tuesday morning that negotiations were still underway. Ambassador Lana Nusseibeh of the United Arab Emirates, the Arab representative on the 15-member council, said she hoped the council could vote on a resolution early Tuesday afternoon.WATCH: Surgeon describes experience treating patients during Israeli bombardment of GazaThe council had scheduled a vote late Monday afternoon, but it was postponed to try to get the U.S. to support the resolution or abstain.The U.S. vetoed a Security Council resolution backed by almost all other council members and dozens of other nations demanding an immediate humanitarian cease-fire in Gaza. The 193-member General Assembly overwhelmingly approved a similar resolution on Dec. 12 by a vote of 153-10, with 23 abstentions.The draft resolution on the table Monday morning called for an “urgent and sustainable cessation of hostilities,” but this language is expected to be watered down in a final draft, possibly to a “suspension” of hostilities or something weaker to get U.S. support, diplomats said, speaking on condition of anonymity because negotiations have been private.Security Council resolutions are important because they are legally binding, but in practice many parties choose to ignore the council’s requests for action. General Assembly resolutions are not legally binding, though they are a significant barometer of world opinion.READ MORE: 3 hostages killed in Gaza by Israeli troops were shirtless and waving a white flag, official saysThe draft resolution that was being considered by the 15 council members Monday morning recognized that civilians in Gaza don’t have access to sufficient food, water, sanitation, electricity, telecommunications and medical services “essential for their survival.” And it expressed the council’s “strong concern for the disproportionate effect that the conflict is having on the lives and well-being of children, women and other civilians in vulnerable situations.”Nearly 20,000 Palestinians have been killed, according to the Gaza Health Ministry since Israel declared war on Hamas following its surprise attacks in southern Israel on Oct. 7. The Hamas militants killed about 1,200 people — mostly civilians — and took about 240 hostages back to Gaza.Hamas controls the Gaza Strip, and its Health Ministry does not differentiate between civilian and combatant deaths. Thousands more Palestinians lie buried under the rubble of Gaza, the U.N. estimates."
WATCH LIVE: America at a Crossroads with Judy Woodruff,"At a time of heightened partisanship, declining trust in institutions, increased political violence, and rapid social change, PBS NewsHour’s senior correspondent Judy Woodruff explores the forces driving Americans apart. For six months Woodruff has traveled the nation, asking people from all walks of life and all political persuasions what might be done to reverse these worrying trends. This one-hour special also explores solutions — engaging academics and civic leaders to talk about strategies that seem to be working, and to find out what more can be done to reconnect Americans across partisan division and build stronger communities.PBS NewsHour’s special, “America at a Crossroads with Judy Woodruff,” will air on PBS on Tuesday, December 19th at 9:00 p.m. ET (check local listings) and on NewsHour’s YouTube channel.View the complete America at a Crossroads series here. "
This is what political division looks like in the U.S. right now,"“America at a Crossroads,” a new one-hour documentary from the PBS NewsHour’s Judy Woodruff, explores what everyday Americans think about the state of the country. Watch at 9 p.m. EST on Tuesday, Dec. 19, on your local PBS station or on YouTube. I started my “America at a Crossroads” reporting project last January with the goal of meeting with and listening to as many Americans as I could, to try to understand why we’re so divided. In all my years of covering politics, I don’t remember a time like this, when people not only hold different views, but in many cases, can’t stand those who disagree with them. Eleven months, 14 states and 21 reports later, I’ve seen examples of people trying to bridge the partisan divide, but I’m still dismayed by the division and the vitriol. I’ve learned a lot about what that division looks and sounds like, but still struggle to understand what’s driving it. It’s not easy to know at what point people move from having strongly held political beliefs to negative partisanship, labeling people on the other side as ignorant or immoral. What causes a long-time friendly rural community around Saegertown, in Western Pennsylvania, to break up into bitter factions over banning books in school libraries and dictating what teachers can discuss about the history of race in America?
Judy Woodruff reports on a district in Pennsylvania where policies around books, gender, sports, race and history have divided some community members. We weren’t able to speak with the School Board member pushing to scrub books in that community.  But one parent, Teresa Barickman, pointed to “political rhetoric that we have heard on the national level has empowered people, and let them feel like it’s okay to say these not-so-nice things about people.”WATCH: The connections between decline of local news and growing political divisionIn our reporting, we found that our own industry – the news media – plays a big role. Whether it’s hearing angry talk on the TV or radio, or reading it on social media, people we spoke to said this news environment has swayed more Americans to hold exaggerated negative assumptions about folks “on the other side.” Some people see through this. What I remember vividly from our sit-down in Cleveland this year with a mixed partisan group of voters who’ve joined the bridging group “Braver Angels” is something Mark Nieberding, a Republican, told me: “If you tell me who you voted for, I can very easily identify you, and I can discount you as a person right way, which is antithetical to what this country should be.”In that same “Braver Angels” conversation, Democrat John Shi pointed a finger at “a bigger problem … our leaders not representing their constituency in the majority sense … polarized voices shouting the loudest or special interests with funded campaigns, to get their messages and opinions heard.” This no doubt contributes to the declining trust people place in Congress and other institutions, and it worries me.  I know there are elected officials who do think about what’s good for the American people. WATCH: How a group of Ohio voters are working to bridge the widening partisan divideBut that doesn’t come across every day as people watch news emanating from Capitol Hill, especially as lawmakers struggle to approve legislation on crucial items like government funding and border security.And history teaches us what can happen when people carry the darkest views of government. This year, we traveled to Oklahoma City to report on how that city is coping in the aftermath of the 1995 bombing of the Murrah Federal Building.
Dennis Purifoy, a survivor of the Oklahoma City bombing, talks with Judy Woodruff about what he remembers from that day, and why he’s worried about extremism now.What motivated a young American, Army veteran Timothy McVeigh, to latch on to an anti-government ideology and carry out that horrific act that killed 168 men, women and children?We want for there to be healthy and vigorous debate in this country. It’s one of the freedoms our founders pinned their hopes on.  But, as long as those debates are within the boundaries of our democratic system, is it possible to do so without thinking the worst thoughts of, looking down on, or feeling aggrieved by, those on the other side?WATCH: Political experts examine America’s divisions heading into 2024 electionThat, along with questions about the other structural, political and cultural forces that are driving us apart, will be some of what we focus on for “America at a Crossroads” in the coming year. I enter 2024 – an election year likely to further deepen divisions — still with many questions, and still dismayed by division in too many communities, between too many people.  But I’m determined to get out in the country and to listen to Americans from every walk of life, knowing if there are answers, we’re more likely to find them there than in Washington. See all pieces in the “America at a Crossroads” reporting project here. "
